2026-05-13 02:02:04,100.9,C:\Users\davib\Sistema-SDR-Inteligente-TCC\dados\brutos\2026-05-13\02h02m00s\chunk.wav,"dos 25 anos. E neste programa especial vamos ouvir Renato Borgette, Elomar, Orquestra e Côro, Vox Brasileenses, Nem Mardias, Orquestra Sinfônica de Indiaia, Tuba, Milton Nascimento, Al Nussáter, Jorge Benjor, Renata Rosa e companhia sinfônica."
2026-05-13 02:02:35,100.9,C:\Users\davib\Sistema-SDR-Inteligente-TCC\dados\brutos\2026-05-13\02h02m33s\chunk.wav,Ouvimos para bem para você com a companhia simfônica e vamos
2026-05-13 02:03:11,100.9,C:\Users\davib\Sistema-SDR-Inteligente-TCC\dados\brutos\2026-05-13\02h03m06s\chunk.wav,"Revisitar o programa com a mensagem de um grande talento brasileiro. O ideal do Ambras para você, o Tolkien está falando, é uma satisfação falar com os ouvintes da ádio que só toca música brasileira de qualidade. Também quero dizer que estou feliz em participar do Brasil regional. No ar desde 2001, o programa abre espaço para novas canções populares e também para aquelas esquecidas no tempo que nos trazem muita saudade nos tal dia. Mas não é só isso, no Brasil regional, a música instrumenta."
2026-05-13 02:03:44,100.9,C:\Users\davib\Sistema-SDR-Inteligente-TCC\dados\brutos\2026-05-13\02h03m39s\chunk.wav,"tem vez, a MPB, tem seu espaço e onde as cantigas de folclore brasileiro são lembradas. Para bem ensarrado senado e a todos que fazem do Brasil regional um dos mais destacados programas de música brasileira. Como Tolkien disse, o Brasil regional está no ar desde 2001. Na nossa linha do tempo vamos relembrar a primeira música tocada na estreia do programa que foi a râcheirinha de Geraldo Flac com Renan."
2026-05-13 02:04:18,100.9,C:\Users\davib\Sistema-SDR-Inteligente-TCC\dados\brutos\2026-05-13\02h04m12s\chunk.wav,do Borgeseh!
2026-05-13 02:13:39,100.9,C:\Users\davib\Sistema-SDR-Inteligente-TCC\dados\brutos\2026-05-13\02h13m36s\chunk.wav,"Ouvimos 7 do Pontau com orquestra unicínio Zancheita e Renato Borgette na Gaeta ponto e Daniel Sa, no violão. Composição de..."
2026-05-13 02:14:14,100.9,C:\Users\davib\Sistema-SDR-Inteligente-TCC\dados\brutos\2026-05-13\02h14m09s\chunk.wav,"Borgette e Vécu Marques, que desde sempre acompanha o Brasil Regional por ser a característica do programa. Antes ouvimos, rancherinha de geral do FACC, com Renato Borgette. Agora, vamos visitar o Brasil profundo, quando as terras Tupiniquins despertavam a curiosidade dos europeus."
2026-05-13 02:14:45,100.9,C:\Users\davib\Sistema-SDR-Inteligente-TCC\dados\brutos\2026-05-13\02h14m42s\chunk.wav,"Vamos ouvir Lundu do Fouplório Popular com Orquestra e Coro Vox Brasileenses, canção recolhida por Karl Friedrich Filipp von Martius, pesquisador alemão que no tempo do Império veio estudar o Brasil."
2026-05-13 02:22:34,100.9,C:\Users\davib\Sistema-SDR-Inteligente-TCC\dados\brutos\2026-05-13\02h22m30s\chunk.wav,"Ouvimos depois da Serra com Orquestra Sinfônica de India atuba, música de Neymar Dias que toca viola de 10 cortas com Orquestra. Um bom exemplo do encontro entre o popular e erudito com a viola caipira atuando como sol..."
2026-05-13 02:23:07,100.9,C:\Users\davib\Sistema-SDR-Inteligente-TCC\dados\brutos\2026-05-13\02h23m03s\chunk.wav,Vamos desovirmos em um duro do Fouplório Popular para o Orquestra e Coro Vox Brasileenses. Você está com o Brasil regional. Essa é a Rádio Semarro. 11 e 22 em Brasília.
2026-05-13 02:23:41,100.9,C:\Users\davib\Sistema-SDR-Inteligente-TCC\dados\brutos\2026-05-13\02h23m36s\chunk.wav,"O Jazz do Brasil está em improviso com Flávio de Matos. Olá pessoal, aqui você houve melhor do Samba Jazz e ainda todas as misturas que enriquecem a música brasileira. Improviso, sexta-feira, 11 da noite, samba da 6 da tarde, segunda-feira, 3 da manhã em Pilarário de Brasília. Você sabe de onde vem a água que chega a sua casa?"
2026-05-13 02:24:15,100.9,C:\Users\davib\Sistema-SDR-Inteligente-TCC\dados\brutos\2026-05-13\02h24m09s\chunk.wav,"água tratada, ela ajuda a proteger a população. Paz água contra a nada pode transmitir doenças com diaireia e dia rdeia-se. Se houver dúvida sobre a qualidade, o ideal é filtrar ou ferver antes de beber. Garantir água limpa é proteger toda a família. A água segura essa hoje, uma parceria radio câmara e radio senado. Em 1957, o senado e a câmara aprovaram dois empítimos presentes."
2026-05-13 02:24:49,100.9,C:\Users\davib\Sistema-SDR-Inteligente-TCC\dados\brutos\2026-05-13\02h24m43s\chunk.wav,"com os abenciais, o de Café Filho e o de Carlos Luz, acusado de tramar contra a poste de Jusselênico do cheque. Primeiro, o Café Filho se licenciou para que lusa a sonha sinterinamente o governo e pudesse consumar o golpe. Mais diante da resistência da aula legalista das postas armadas veio o primeiro vítima. Em seguida, o Café Filho tentou voltar ao poder, mas não conseguiu e também foi recastado. Primeiro, o ramos, presidente do Senado, foi tempo e um mandado. Em 1910..."
2026-05-13 02:25:19,100.9,C:\Users\davib\Sistema-SDR-Inteligente-TCC\dados\brutos\2026-05-13\02h25m16s\chunk.wav,"56 transmitiu a presidência da República para JK. Arquivo é-se, o Senado na História do Brasil, uma parceria rádio, agência e arquivo do Senado. Continui com o Brasil regional."
2026-05-13 02:25:53,100.9,C:\Users\davib\Sistema-SDR-Inteligente-TCC\dados\brutos\2026-05-13\02h25m49s\chunk.wav,"Elamar é uma artista que conhece a alma do sertanejo e também é um dos inspiradores para a existência do programa Brasil Regional. O ponto de inflexão foi o álbum duplo, na quadrada das águas perdidas, gravado em 1978 e lançado em 1979."
2026-05-13 02:26:24,100.9,C:\Users\davib\Sistema-SDR-Inteligente-TCC\dados\brutos\2026-05-13\02h26m22s\chunk.wav,deste trabalho vamos ouvir a rumação com Elon Musk autor da canção.
2026-05-13 02:28:11,100.9,C:\Users\davib\Sistema-SDR-Inteligente-TCC\dados\brutos\2026-05-13\02h28m01s\chunk.wav,"Vai, vai de tua fôr Tu catulhar, pera o catador Tão o plantar, deixando o fôr Uma nova, sua sara não vai passar Ah não aku que não tá MARHe"
2026-05-13 02:29:11,100.9,C:\Users\davib\Sistema-SDR-Inteligente-TCC\dados\brutos\2026-05-13\02h29m08s\chunk.wav,"O cícans já subiram ver a rir É só cãs todo ano nunca vi Mas se isso já não aguenta a vice-guição Já são cá no veio, desse meu centro"
2026-05-13 02:29:45,100.9,C:\Users\davib\Sistema-SDR-Inteligente-TCC\dados\brutos\2026-05-13\02h29m41s\chunk.wav,A minha matrão O cúcadula Pera o cacado A mucatã Fês a mucatã O cúcadula Pera o cacado A mucatã Fês a mucatã O cúcadula Pera o cacado A mucatã
2026-05-13 02:31:38,100.9,C:\Users\davib\Sistema-SDR-Inteligente-TCC\dados\brutos\2026-05-13\02h31m20s\chunk.wav,"O Sora, que paliaram, Tata. O Sora, que paliaram, Tata. O Ié, Pani, Nengan, Nihana. O Ié, Pani, Nihana. O Ié, Pani, Nihana. Balacram, Balali, Kayo, Briganto. E Moreu, Sensintragal. Sora, que paliaram, Tata. O Ié, Pani, Nihana. O Ié, Pani, Nihana. O Ié, Pani, Nihana."
2026-05-13 02:32:29,100.9,C:\Users\davib\Sistema-SDR-Inteligente-TCC\dados\brutos\2026-05-13\02h32m27s\chunk.wav,"A minha fortina hoje, somdo rei o atraição Mas o risco voltou lá e lavou a honra do sertão E da tarde veio pra nos contar Quem da tarde veio pra nos contar"
2026-05-13 02:33:52,100.9,C:\Users\davib\Sistema-SDR-Inteligente-TCC\dados\brutos\2026-05-13\02h33m34s\chunk.wav,E o que falem de João Mamade? O reiro morerá a sasa e sua tropa da cidade E só a tomar dar o veborismo e só E valear dar a dor E vai matar o meu porristo e só E valear dar a dor Apenadar o meu porristo e só E valear dar a dor Apenadar o veborismo e só E valear dar a dor A minha continho hoje só morreu a traição Acho que eu coresco voltou lá e песla
2026-05-13 02:34:45,100.9,C:\Users\davib\Sistema-SDR-Inteligente-TCC\dados\brutos\2026-05-13\02h34m40s\chunk.wav,"Houvemos coris que dá dar com elio contrairas, autor que une música e história ao cantar a morte do cangaceiro corisco e o ferimento de sua companheira, a canção narra, a bravura do casal, em combate sem se entregar. Corisco e dá dar está no álbum Esturda Onça de 1991, antes ouvimos a arrumação de autoria e interpretação de Elon Musk."
2026-05-13 02:35:18,100.9,C:\Users\davib\Sistema-SDR-Inteligente-TCC\dados\brutos\2026-05-13\02h35m13s\chunk.wav,"Neste 25 anos mostramos que a música brasileira bebe em várias fontes e uma delas é o rock. Os Beatles, por exemplo, permearam a mente musical dos fans. Milton nascimento, a Oleyn de Compôr uma canção para o Leno e Marcarne, também interpretou Hello Good Bye, Já o Tôria."
2026-05-13 02:35:47,100.9,C:\Users\davib\Sistema-SDR-Inteligente-TCC\dados\brutos\2026-05-13\02h35m46s\chunk.wav,da dupla.
2026-05-13 02:36:53,100.9,C:\Users\davib\Sistema-SDR-Inteligente-TCC\dados\brutos\2026-05-13\02h36m19s\chunk.wav,Oh oh oh Oh oh oh Você disse Eu disse Não Você disse Eu disse Chua
2026-05-13 02:36:57,100.9,C:\Users\davib\Sistema-SDR-Inteligente-TCC\dados\brutos\2026-05-13\02h36m53s\chunk.wav,"Eu sei que é bom E eu sei Hello Hello Eu estou mal, eu sei que é bom Eu sei que é bom Hello Eu sei que é bom Eu sei que é bom Eu sei que é bom"
