2026-05-12 20:13:17,98.1,C:/Users/davib/Sistema-SDR-Inteligente-TCC/dados/brutos\2026-05-12\20h13m11s\chunk.wav,"e a preocupação essa decisão. A gente segue em Brasília agora para falar sobre escala seis por um expectativa presença do ministro Dario Durigan na Comissão Especial que está discutindo esse tema, a Arissa Lopes está por lá e a Arissa Bata-Arde. Oi, Sara Algo, boa tarde para você, panadéia de todos. Olha o ministro da Falada da Irmã Durigan, ele acabou de chegar aqui na Comissão Especial da Câmara do Deputado e trata sobre um fim da escala seis por um. A gente vai falar sobre as séculos e conosco."
2026-05-12 20:14:17,98.1,C:/Users/davib/Sistema-SDR-Inteligente-TCC/dados/brutos\2026-05-12\20h13m44s\chunk.wav,miejsce ganta e fica exigindo que podemos citar de forma coinéria que assim para este outcome musical ela görd awareness dessa maneira você vai dizer Aprê vídeo nouvellea só só чтобы que 후보 itu Джís sacrime com não tem arrρωada mais de um dia que kamu do suor com selada ia saberify lá para q e aская cor e na Praga traóqui e tesse
2026-05-12 20:14:22,98.1,C:/Users/davib/Sistema-SDR-Inteligente-TCC/dados/brutos\2026-05-12\20h14m16s\chunk.wav,"os autorizados e requerimentos, então, aligaram que a sobressão precisa conhecer diagnósticos e tudo e certiza sobre os imparques econômicos da revisão da jornada de trabalho e da reorganização da escala colaborais. Os deputados também afirmam que precisam de dados sobre aspectos e também partos ao ativéssia de revisão do uso do tempo, do trabalho na perspectiva instrucionado da"
2026-05-12 20:14:55,98.1,C:/Users/davib/Sistema-SDR-Inteligente-TCC/dados/brutos\2026-05-12\20h14m49s\chunk.wav,"e a gente vai te dar a comissão especial. Então hoje que eles pro da fazenda vai ser ouvido na semana fatada já teve o ministro do trabalho no mesmo marinho e em tivés também movimentos sociais vão falar que na comissão ao longo de quão de setões pra acé de a vinte e sete de maio votado na comunidade especial e depois partir para o planário ascendente é de aprovação. Carol. Acerto, obrigada, Larissa. Em 13 minutos vamos pronunciar o internas."
2026-05-12 20:15:27,98.1,C:/Users/davib/Sistema-SDR-Inteligente-TCC/dados/brutos\2026-05-12\20h15m21s\chunk.wav,"que está acompanhando a Instituição Paulo e a Ana Luisa Bessa, boa tarde. Na ideia de uma última tarde a você e os nossos ouvintes o presidente dos Estados Unidos do Não de Trump viajou na esta terça-feira a China onde vai se encontrar com o presidente Xíginpinge na manhã de quinta feira pelo horário local o que seria na noite de quarta-feira aqui no Brasil. O líder americano deve chegar a Pekín a manhã para a visita de Estado ao país que vai durar até o dia quinta e a feira."
2026-05-12 20:15:59,98.1,C:/Users/davib/Sistema-SDR-Inteligente-TCC/dados/brutos\2026-05-12\20h15m54s\chunk.wav,"Essa na dédias será a primeira viagem à China de Trump desde 2017. E o primeiro encontro entre Xi Jinping e Trump em seis meses. A última vez que eles conversaram foi na Coreia do Sul no ano passado. A reunião com presidente chinês deve gerar em torno de uma série de pautas complexas entre os dois países, como armas nucleares, inteligência artificial, terras haras e, principalmente, o comércio bilateral. A viagem de Trump e acontece..."
2026-05-13 01:23:53,100.9,C:\Users\davib\Sistema-SDR-Inteligente-TCC\dados\brutos\2026-05-13\01h23m45s\chunk.wav,"O caíme é um solar A vida não é uma molha, você é uma molha O caíme é um solar A vida não é uma molha, você é uma molha Você é uma molha, você é uma molha Rádio Senado, Aracaju, 103,9"
2026-05-13 01:24:23,100.9,C:\Users\davib\Sistema-SDR-Inteligente-TCC\dados\brutos\2026-05-13\01h24m19s\chunk.wav,"Finaça casa ninguém era sua boa educação Os dias que tem comida comemos comida com a mão E quando a polícia do hemçadista não sabe alguma discussão E separ onde um irmão é Sintimos que nunca acabava de caber a martorra com coração Mais não, choramos a toa"
2026-05-13 01:25:00,100.9,C:\Users\davib\Sistema-SDR-Inteligente-TCC\dados\brutos\2026-05-13\01h24m52s\chunk.wav,"Choramos atual Que nessa tribo ninguém quer a sua carteira deização Falamos a sua língua mas não entendemos a sua mão Nós vimos alto, bebemos e falamos para a plau Mas não soremos atual Não soremos atual Que nesse barco ninguém quer a sua orientação Não soremos atual"
2026-05-13 01:25:29,100.9,C:\Users\davib\Sistema-SDR-Inteligente-TCC\dados\brutos\2026-05-13\01h25m26s\chunk.wav,"A vida que vai aderir, vai a nossa condição Mas não seguimos a tua Não seguimos a tua Votos para o seu lado Votos para o seu lado Votos para o seu lado"
2026-05-13 01:26:02,100.9,C:\Users\davib\Sistema-SDR-Inteligente-TCC\dados\brutos\2026-05-13\01h25m59s\chunk.wav,Vão te falar o celular Vão te falar Vão te falar o celular Vão te falar Que nessa casa nem me quero a sua boa educação Os dias que tem comida com menos comida para a mão A polícia do insato está em sua alguma disposição
2026-05-13 01:26:49,100.9,C:\Users\davib\Sistema-SDR-Inteligente-TCC\dados\brutos\2026-05-13\01h26m33s\chunk.wav,"Não se separam de um irmão Se timos que nunca acabam de caber Mas todo no coé são Mas não, choramos atual Não, choramos atual Que nessa pribo ninguém quer Sua carta tem que desassar Falamos a sua língua Mas não entendemos seu sermão Nós, irmãos alto, bebemos E falamos parabão Mas não, só vimos atual"
2026-05-13 01:27:31,100.9,C:\Users\davib\Sistema-SDR-Inteligente-TCC\dados\brutos\2026-05-13\01h27m17s\chunk.wav,"Não, só que me voando, que nesse patinho que quero a sua criação A saudadeira é só, que me ali na nossa condição Mas não, não seguimos a tua Não, não seguimos a tua Não vou te parar ao seu lado Não vou te parar ao seu lado Não vou te parar ao seu lado Não, não..."
2026-05-13 01:27:54,100.9,C:\Users\davib\Sistema-SDR-Inteligente-TCC\dados\brutos\2026-05-13\01h27m51s\chunk.wav,"Faltz, fala Vim, fala, vim, fala Faltz, fala Faltz, fala, vim, fala Faltz, fala"
2026-05-13 01:28:44,100.9,C:\Users\davib\Sistema-SDR-Inteligente-TCC\dados\brutos\2026-05-13\01h28m24s\chunk.wav,onent. Essa filled animada
2026-05-13 01:29:04,100.9,C:\Users\davib\Sistema-SDR-Inteligente-TCC\dados\brutos\2026-05-13\01h28m58s\chunk.wav,"e volta para o celular. Pedro mais e a parede cai no sungue. A primeira foi manhã, não pedaço de picado. A Comissão de Mê-Obiente aprovou a criação da programa Rios Livres da Amazônia, que tem objetivo de promover a navigabilidade e a conservação de rios da região. A criação do programa Rios da Amazônia segue agora para votação na Câmara dos Deputados, mas detalhes com o reporter Marcio Maturana. Na Vigar, nos vios da Amazônia pode ficar menos complic..."
2026-05-13 01:29:37,100.9,C:\Users\davib\Sistema-SDR-Inteligente-TCC\dados\brutos\2026-05-13\01h29m31s\chunk.wav,"com o projeto aprovado pela Comissão de Meia O ambiente em turno suplementar. A criação do programa Rios Livres da Amazonia foi proposta pelo Senador Sejo Pt. Cão do PSD do Acre. Mas não temos estrada, que essas pessoas precisam, as têm até o direito de vi. Então, o objetivo do nosso projeto é exatamente isso. É que o governo municipal, o governo estadual, o governo federal possam da transfigabilidade a essas pessoas que moram às mar e do Rio. Pelo projeto, o programa vai compatibilizar o desenvolvimento sócio econômico da Amazonia."
2026-05-13 01:30:10,100.9,C:\Users\davib\Sistema-SDR-Inteligente-TCC\dados\brutos\2026-05-13\01h30m04s\chunk.wav,"legal com a preservação da qualidade dos recursos idricos, estimular a educação ambiental e reduzir os níveis de poluição e os danos ambientais. O texto final aprovado eliminou a figura do comiteigestor e é um sustitutivo do ex-senador Messeis de Jesus de Roraima. E o esse projeto é exatamente sobre isso e ele só não atiza mas mantém todo a concentração da navegação sobre o comitei que já existe nacionalmente apenas incluindo Amazonicos no meio que dentro desse comiteigestor."
2026-05-13 01:30:40,100.9,C:\Users\davib\Sistema-SDR-Inteligente-TCC\dados\brutos\2026-05-13\01h30m37s\chunk.wav,"tem de fato alguém que conheça sobre a realidade amazônica, isso. A criação do programa Rios Livres da Amazônia agora segue para a votação na Câmara dos Deputados. Em Brasília, 10 e meia. Põe-se agora, Cúrgulhinho!"
2026-05-13 01:31:14,100.9,C:\Users\davib\Sistema-SDR-Inteligente-TCC\dados\brutos\2026-05-13\01h31m10s\chunk.wav,"Mais um dia a besta, aqui no meu moco Quero fazer conta, vim grossar o carro do moco to Escare gaire direto, o corpo da cabeça Eu não desescontro lado, uns é nois e dá ligado Não deixe a cair, com o fac, que eu só quero te contar"
2026-05-13 01:31:53,100.9,C:\Users\davib\Sistema-SDR-Inteligente-TCC\dados\brutos\2026-05-13\01h31m43s\chunk.wav,"Com o pacto, o seu cedado, o compacto Um fino, um raro, o compacto Que eu só quero ouvir, então deixar carinho Com o pacto, ser carinho, um compacto Em electricidade, o compacto Se enchirará e crescer Um sumi seus pés Deixará até passear a vida Eu sei pra te bail"
2026-05-13 01:32:21,100.9,C:\Users\davib\Sistema-SDR-Inteligente-TCC\dados\brutos\2026-05-13\01h32m17s\chunk.wav,"Deixa caro e o barco Eu sou perdi, o barco Suo ser dado, o barco No meu pé, no meu lado Com o barco, no final Com o barco Eu só quero vir Com o barco, donde eu sacar ir Com o barco Eu sou perdi, com o barco No meu pé, no meu lado Com o barco Quer de eu sucedado Com o barco"
2026-05-13 01:33:26,100.9,C:\Users\davib\Sistema-SDR-Inteligente-TCC\dados\brutos\2026-05-13\01h32m50s\chunk.wav,que se poe Innena Devol creativityividaש ele Diayy Essa cena ро Des Porte ChungãoACS Que dança Oind
2026-05-13 01:33:37,100.9,C:\Users\davib\Sistema-SDR-Inteligente-TCC\dados\brutos\2026-05-13\01h33m23s\chunk.wav,"o início do monte e comece novamente vamos então escutar volta do chute, vamos melhores pra dan, preparado e já um, um, um, um, um, um, um, um, dois, um, dois, três, quatro volta do chute, que eu não quero me marro quando eu deixa pra ir volta do chute, que eu não quero me"
2026-05-13 01:34:15,100.9,C:\Users\davib\Sistema-SDR-Inteligente-TCC\dados\brutos\2026-05-13\01h33m56s\chunk.wav,E outrarução de tampa. Temam mais diversos boob 가자ções. Oi. Mas o parque deu até xácar.
2026-05-13 01:34:32,100.9,C:\Users\davib\Sistema-SDR-Inteligente-TCC\dados\brutos\2026-05-13\01h34m29s\chunk.wav,Preparei uma roda de sangue a sopa ela Mas ela não sombra e se problema dela Entreguei um pouquinho seguro só pra ela Mas ela não jogar e se problema dela E se problema dela
2026-05-13 01:35:06,100.9,C:\Users\davib\Sistema-SDR-Inteligente-TCC\dados\brutos\2026-05-13\01h35m02s\chunk.wav,"E cê problema dela, e cê problema dela Problema dela, tô cansado de andar por aí curtindo quem não é Precupado em pintar uma jogada aqui da pé Só que tem que eu tô numa tão certa que ninguém me diz Eu não sou o que bele fazer o que eu não vi"
2026-05-13 01:35:39,100.9,C:\Users\davib\Sistema-SDR-Inteligente-TCC\dados\brutos\2026-05-13\01h35m35s\chunk.wav,Separei em pedaço de bolos só pra ela Mas ela não provar E se é problema dela Inventei na semana do mundo E só pra ela Se ela for trabalhar E se é problema dela E se é problema dela E se é problema dela E se é problema dela
2026-05-13 01:36:17,100.9,C:\Users\davib\Sistema-SDR-Inteligente-TCC\dados\brutos\2026-05-13\01h36m08s\chunk.wav,"O problema dela, o problema dela Tô cansado de andar por aí, Portindo que não é Preputado em pintar na jogada aqui da pê Só que tenho que eu to numa tão certa que ninguém me diz Quem eu sou que devo fazer o que eu não fiz Pra entrei e roubforzia"
2026-05-13 01:36:45,100.9,C:\Users\davib\Sistema-SDR-Inteligente-TCC\dados\brutos\2026-05-13\01h36m41s\chunk.wav,Onde você andar é só pra ela Mas ela não usa Essa é problema dela A lubei uma roda gigante só Pra ela Mas ela não muda Essa é problema dela Essa é problema dela Essa é problema dela Problema dela Essa é problema dela
2026-05-13 01:37:16,100.9,C:\Users\davib\Sistema-SDR-Inteligente-TCC\dados\brutos\2026-05-13\01h37m14s\chunk.wav,"Rádio Senado, Belém, 101,5"
2026-05-13 01:37:56,100.9,C:\Users\davib\Sistema-SDR-Inteligente-TCC\dados\brutos\2026-05-13\01h37m47s\chunk.wav,"Na carcaça, quando se vê tudo isso passa Upa, na smoked arsupa"
2026-05-13 01:38:22,100.9,C:\Users\davib\Sistema-SDR-Inteligente-TCC\dados\brutos\2026-05-13\01h38m20s\chunk.wav,"Fortes, facas cascas Só me lembra a olhar Já manda Tu, que tu saia E na casa em tudo Que patas"
2026-05-13 01:38:57,100.9,C:\Users\davib\Sistema-SDR-Inteligente-TCC\dados\brutos\2026-05-13\01h38m53s\chunk.wav,LONGE O PERTU E derreter o futuro incerto Salve Santa Clara O abri é devaluar na mala E os livagagens E os livagagens E os livagagens E os livagagens
2026-05-13 01:39:56,100.9,C:\Users\davib\Sistema-SDR-Inteligente-TCC\dados\brutos\2026-05-13\01h39m26s\chunk.wav,"Aura, minha dernière manha Hurou de a luz bem negro Escusso Abra-te! saw"
2026-05-13 01:40:09,100.9,C:\Users\davib\Sistema-SDR-Inteligente-TCC\dados\brutos\2026-05-13\01h39m59s\chunk.wav,"Já misturada no meio da massa Gelo, desespero Esse moviu pra me dar um beijo Nada nem te leve Mas me contra tão breve Seco, mais um impária És um ant homepage do huminya"
2026-05-13 01:41:22,100.9,C:\Users\davib\Sistema-SDR-Inteligente-TCC\dados\brutos\2026-05-13\01h41m05s\chunk.wav,"Na rádio Senado ouvimos, Maurício Pereira,icked de café da Portugia. Tinha um par de fracos, a trusted유�ava mесто e sem olh DOMRA. Tova 1951 Na rádio Senado ouvimos o Maurício Pereira, maldito a roda viagem."
2026-05-13 01:41:43,100.9,C:\Users\davib\Sistema-SDR-Inteligente-TCC\dados\brutos\2026-05-13\01h41m38s\chunk.wav,"A Dóres Montaño é isso aí. A primeira foi com o Minha Compacto. A Dicevada. Agora em Brasília, 10 e 41. Já pensei por tantas vezes. Nesta semana no escala brasileira, a cantora e compositora Dora Sanchis. Desde um ponto na vinha lembro de como estar com todas as minhas próprias letras. Pra mim sempre me encantar muito."
2026-05-13 01:42:17,100.9,C:\Users\davib\Sistema-SDR-Inteligente-TCC\dados\brutos\2026-05-13\01h42m11s\chunk.wav,"A liberdade é a composição e a nossa experiência para quem encontra muito em equipe dora. Escalabrazeleira, quinta, vinte e três horas na RAID o Senado, reprisa no domingo de 19 horas e na terça três da madrugada. A licença paternidade vai ser ampliada, com a nova lei, o afastamento aumenta de cinco para até vinte dias de forma gradual. A nova legislação, garante estabilidade no emprego e criou salário paternidade. A licença também vale para mim, sal!"
2026-05-13 01:42:50,100.9,C:\Users\davib\Sistema-SDR-Inteligente-TCC\dados\brutos\2026-05-13\01h42m44s\chunk.wav,"e trabalhadores domésticos, um avanço na proteção da sua milha e na divisão mais justa do cuidado com os filhos. O Senado votou agora a Elei, uma campanha radio-senado. Projetos em destaque, as principais propostas em análise no Senado. Conheça os projetos que vão começar a ser debatidos as novas ideias e sugestões legislativas ao opinião dos autores e o caminho das propostas até a sua votação. Projetos em..."
2026-05-13 01:43:23,100.9,C:\Users\davib\Sistema-SDR-Inteligente-TCC\dados\brutos\2026-05-13\01h43m16s\chunk.wav,"destaques sexta-feira, às duas da tarde e sábado às oito da manhã do Pilarário de Brasília. Bom, é de você ouvir um contra de galco, tem Maria Betânia."
2026-05-13 01:43:53,100.9,C:\Users\davib\Sistema-SDR-Inteligente-TCC\dados\brutos\2026-05-13\01h43m50s\chunk.wav,"Quando eu fico muito triste, eu pego uma fotografia da minha mãe E aberto bem forte no meu peito Minhas mãos param de tremere, segurando uma fotografia"
2026-05-13 01:44:26,100.9,C:\Users\davib\Sistema-SDR-Inteligente-TCC\dados\brutos\2026-05-13\01h44m22s\chunk.wav,E meu coração bate mais forte Mas não é mais um humano que eu sinto Vem me transformo Por suído de alegria que volta a mim E todo esse recinto E que não tem
2026-05-13 01:45:18,100.9,C:\Users\davib\Sistema-SDR-Inteligente-TCC\dados\brutos\2026-05-13\01h44m56s\chunk.wav,explicação e eu choro de abriar ressando aos pés de nossa senhora a parecida em um encouraged bube para mim
2026-05-13 01:45:30,100.9,C:\Users\davib\Sistema-SDR-Inteligente-TCC\dados\brutos\2026-05-13\01h45m28s\chunk.wav,E sempre ela me dará vida Me ama em meu vida E sempre ela me dará vida
2026-05-13 01:46:04,100.9,C:\Users\davib\Sistema-SDR-Inteligente-TCC\dados\brutos\2026-05-13\01h46m01s\chunk.wav,"Mas não é mais, meu amor, que eu sinto Eu me trouxe vo..."
2026-05-13 01:46:37,100.9,C:\Users\davib\Sistema-SDR-Inteligente-TCC\dados\brutos\2026-05-13\01h46m34s\chunk.wav,"Posso ir do dia de criar, quem fade a mim, e todo esse recinto, que não fez percação E a gente é o chão Jabilia A gente é o chão"
2026-05-13 01:47:11,100.9,C:\Users\davib\Sistema-SDR-Inteligente-TCC\dados\brutos\2026-05-13\01h47m07s\chunk.wav,"A luz mais de nossa senhora, a mais cidadã Minha mãe me deu a vida E sem derê-la vida, a vida Minha mãe me deu a vida E sem derê-la vida, a vida"
2026-05-13 01:47:42,100.9,C:\Users\davib\Sistema-SDR-Inteligente-TCC\dados\brutos\2026-05-13\01h47m41s\chunk.wav,A vida!
2026-05-13 01:48:55,100.9,C:\Users\davib\Sistema-SDR-Inteligente-TCC\dados\brutos\2026-05-13\01h48m47s\chunk.wav,"Lá vai o clico, Lá vai a vida rodar Lá vai ser a tristeção Cidade no teatia Lá vai o trense de estilho Brutia, mô, vi, cora Crimil-nui"
2026-05-13 01:49:22,100.9,C:\Users\davib\Sistema-SDR-Inteligente-TCC\dados\brutos\2026-05-13\01h49m20s\chunk.wav,"E pela tela vai ter la seva, vai ter o mar Que também pela serra no mar O rei tem que as estrelas avuar, no mar"
2026-05-13 01:50:05,100.9,C:\Users\davib\Sistema-SDR-Inteligente-TCC\dados\brutos\2026-05-13\01h49m53s\chunk.wav,"Opa, vai o indo! Ava, é a vida! Opa, vai simrande de si! S Fifthack muito tard Muito tard� Opa, vai O 105! David, controlled Of reduced Um Um thoma de part надquimizh"
2026-05-13 01:50:30,100.9,C:\Users\davib\Sistema-SDR-Inteligente-TCC\dados\brutos\2026-05-13\01h50m26s\chunk.wav,"Sem destino, o dia 9 é montar Corrindo vai ver a terra, vai ver a sera, vai ver o mar Cantando pela sala, vai ver Corrindo entre as estrelas, vai ver"
2026-05-13 01:51:01,100.9,C:\Users\davib\Sistema-SDR-Inteligente-TCC\dados\brutos\2026-05-13\01h50m59s\chunk.wav,"Rádio Senado, boa vista, 98,3."
2026-05-13 01:51:38,100.9,C:\Users\davib\Sistema-SDR-Inteligente-TCC\dados\brutos\2026-05-13\01h51m32s\chunk.wav,"Não falo de pão que não me lembro de me agarrelhar em duro Pra que toda a pose doito pra que esse mundo A bruxa que segue esparra na gente e a vida distra-me O enfarte em pé do cú e acaba nessa manga A vayidade é assim, põe o bomo no alto e leite na escada A gente não perdo e espera no cem pão Mas ela não está de ele e estava no chão Mas ela não está de qualquer jeito no maior auto"
2026-05-13 01:52:32,100.9,C:\Users\davib\Sistema-SDR-Inteligente-TCC\dados\brutos\2026-05-13\01h52m05s\chunk.wav,Confinão. Convorei mar com a vida
2026-05-13 01:53:56,100.9,C:\Users\davib\Sistema-SDR-Inteligente-TCC\dados\brutos\2026-05-13\01h53m44s\chunk.wav,"Não dá regar em tudo, tá quem tá na pós-elotor Pra que esse ouro? A bruxa que acerta, espanha a gente a vida É isto, hein? O infarte pega do corpo e acaba nessa roupa A vayidade é assim, o poinho bomba no alto E a tira escala, mas fica por perto Espendo do seu fato, mas se com a cidade Ele acaba no chão, mas há um pouco Não é o tempo no corpo, não é o final Todo mundo é igual quando a gente na terina Não deve be hospitals"
2026-05-13 01:54:20,100.9,C:\Users\davib\Sistema-SDR-Inteligente-TCC\dados\brutos\2026-05-13\01h54m17s\chunk.wav,"Rádio Senado, Massa Ior, 105,5 Rádio Senado, Massa Ior, 105,5"
2026-05-13 01:54:57,100.9,C:\Users\davib\Sistema-SDR-Inteligente-TCC\dados\brutos\2026-05-13\01h54m51s\chunk.wav,"de tatu, ligue e separei, pois é boa, a paga pongo, a mo de saia, na co de perro, a mo de pouco, conto cú, e bom não te fombar, barriga tá igual, a onde que tem, e no balá, eu tenho também o som, bota, o ordem do som, eu não vi a lação, dezem de que vi, e no balá, eu vi o tambem, o pé gala, não tomo a la da gada do som, bota, um candor de feijão, não bota, paga e colasse, bota, que se..."
2026-05-13 01:55:43,100.9,C:\Users\davib\Sistema-SDR-Inteligente-TCC\dados\brutos\2026-05-13\01h55m24s\chunk.wav,Um namorado mexerão A água de bensé Linha de pásseis chímaram Barbalo é A vô de arraio Com voção e torna de tatu Vim o seu pai reposar pão A pã da cungul A vô de saia Na púde pire Lão de pão com o pão do E pão no de fupa Parigata é igual A honte de que tem E no balar Eu sei também o som do ar Tão voltando o som E não vi a relação A da pra lá2 tasty chefJeff de
2026-05-13 01:56:03,100.9,C:\Users\davib\Sistema-SDR-Inteligente-TCC\dados\brutos\2026-05-13\01h55m57s\chunk.wav,"O meu Deus também, o pega lá Não toma lá na cada samba Não dá o lute sem jão Bapapá em coleção Pão cabissiri, um namorado mexilhão A água de benzei, brinhando de paz e chrimoram Bapá no alô, amou de alô E convozão meia Para, para, para, para Para, para, para E se vamos ao lado de o meu Para, para, para, para Para, para, para, para Para, para, para, para"
2026-05-13 01:56:35,100.9,C:\Users\davib\Sistema-SDR-Inteligente-TCC\dados\brutos\2026-05-13\01h56m30s\chunk.wav,"Cânaca Fumé Fanda no casulete Sereno e pé No chão Palas que estão bombando E no café cá até tudo tem vai Pão, pão, pão Já era tiro lesão da rincha galeria A marim que veio vai dar voz a hoje em dia Há la pa, é só las, bora, cola, fala, fala, fala E lavei com a pelas que nem marquem de bombar o mal"
2026-05-13 01:57:09,100.9,C:\Users\davib\Sistema-SDR-Inteligente-TCC\dados\brutos\2026-05-13\01h57m03s\chunk.wav,"Lights in sarong, pondes londas, quingues, gombes Meu vida é o primeiro, é muita amanevada Fui o jazaco gata retofado, jogo de capra e tu ia ver a amada Quer não tonaris, na garada de juiz Aí, não é quem foda uma cajarrada E quem na valera, o jogo é patocida Feliz da Asminha Mala, mala, mala, mala, mala, tu é ele, não dá Não dá nem a contada em a donão É que não pado ler no desolado"
2026-05-13 01:57:42,100.9,C:\Users\davib\Sistema-SDR-Inteligente-TCC\dados\brutos\2026-05-13\01h57m36s\chunk.wav,"de só não para o louco tá que no padulo de sombra, pava, ver no digo só cantita do ele se pira e paga e bora apana e congura aputeçaya do nago de piro lavante, poupando tudo viponude, pumbamba, rinca, taver via uns que tem no talágio tem também só voção, voção, voção, voção, voção, voção de tiros que vi o viro talágio, viu, ta veio, pega lá no tomá la da cara"
2026-05-13 01:58:13,100.9,C:\Users\davib\Sistema-SDR-Inteligente-TCC\dados\brutos\2026-05-13\01h58m09s\chunk.wav,"TUSABA TUSABA TUSABA TUSABA TUSABA Esse foi João Bosco, Nando Passe, Badea Sade, a banca do Dixito. Boca livre, oitrizando, caipira e também ao coste mais..."
2026-05-13 01:58:46,100.9,C:\Users\davib\Sistema-SDR-Inteligente-TCC\dados\brutos\2026-05-13\01h58m42s\chunk.wav,"com a vida de tão mamãe. Essa é a Hattie Sondado. Agora em Brasília, 10 e 58. O capítulo rock desta semana são marcante dos americanos do The Black Rose, os clássicos do álbum Shaker Money Maker que é trajetória dos irmãos Robinson em destaque. Uma viagem pelo blues rock dos anos 90 com sucessos como Hattie Handle."
2026-05-13 01:59:20,100.9,C:\Users\davib\Sistema-SDR-Inteligente-TCC\dados\brutos\2026-05-13\01h59m14s\chunk.wav,"O Périca, Capitulóque de Black Cross, é neste sapo às 10 da noite no domingo a 3 da tarde, aqui na Rádio Senado. Os povos indígenas resistem a mais de 500 anos. Mesmo diante de desafios, seguem preservando sua cultura e sua identidade. Uma história marcada pela força e pela defesa de seus territórios e tradições. Resistência que ensina coragem. Resistência que inspira valorização."
2026-05-13 01:59:53,100.9,C:\Users\davib\Sistema-SDR-Inteligente-TCC\dados\brutos\2026-05-13\01h59m48s\chunk.wav,"Obos indígenas, respeito, reconhecimento e valorização, uma parceria, rádio senado e rádio câmera. Faça bonito! A puso sexual é o uso do corpo de crianças ou adolescentes para satisfação sexual de pessoas adultas ou mais velhas. Ele pode ocorrer com ou sem toque físico, com ou sem violência física e quase sempre é praticado por pessoas próximas à vítima. O abuso sexual acontece em todos os níveis sociais. Cadre o silêncio de..."
2026-05-13 02:00:27,100.9,C:\Users\davib\Sistema-SDR-Inteligente-TCC\dados\brutos\2026-05-13\02h00m21s\chunk.wav,"que sei, uma passaria da Rádio Câmara e Rádio Senado. Sabe aquela mensagem sobre o Senado que chegou no grupo da família? Antes de compartilhar, Verifique. O Senado Verifíter agora está no WhatsApp. Meia 1, 9,8190,0301. Envi o texto link, eu imagine que você recebeu. Nossa equipe confere e te disse, é verdade ou mentira. Evite cair em fake news. Na dúvida, fale com o Senado Verifíter pelo WhatsApp. Meia 1, 9,8190,0301."
2026-05-13 02:00:58,100.9,C:\Users\davib\Sistema-SDR-Inteligente-TCC\dados\brutos\2026-05-13\02h00m54s\chunk.wav,"em Brasília, pontuamente, 11 horas. Zyps 11, 487, Rádio Semado, Brasília, FN 91,7 Veda Rags. Cremam a Saio 105,5 em Manaus, 106,9 em Campo Grande, 105,5."
2026-05-13 02:01:31,100.9,C:\Users\davib\Sistema-SDR-Inteligente-TCC\dados\brutos\2026-05-13\02h01m27s\chunk.wav,"A partir de agora você fica com o Deral do Gular no Brasil Regional, um passeio pela música da nossa perra. E está começando mais um Brasil Regional, o Brasil nunca civil tão rio. Abrimos com a tradicional Melodia Festiva para marcar o início dessa edição comemorativa."
